<formats xmlns="http://io-tools.googlecode.com/format-info/"
	xmlns:xsi="http://www.w3.org/2001/XMLSchema-instance"
	xsi:schemaLocation="http://io-tools.googlecode.com/format-info/ formatInfo.xsd ">
	<format>
		<name>AVI</name>
		<description>Audio/Video Interleaved</description>
		<mimetypes></mimetypes>
		<extensions>avi</extensions>
	</format>
	<format>
		<name>ZIP</name>
		<description></description>
		<mimetypes></mimetypes>
		<extensions>zip</extensions>
	</format>
	<format>
		<name>ZIP</name>
		<description></description>
		<mimetypes></mimetypes>
		<extensions></extensions>
		<superseeds></superseeds>
	</format>
	<format>
		<name>ZIP</name>
		<description></description>
		<mimetypes></mimetypes>
		<extensions></extensions>
		<superseeds></superseeds>
	</format>
	<format>
		<name>ZIP</name>
		<description></description>
		<mimetypes></mimetypes>
		<extensions></extensions>
		<superseeds></superseeds>
	</format>
	<format>
		<name>ZIP</name>
		<description></description>
		<mimetypes></mimetypes>
		<extensions></extensions>
		<superseeds></superseeds>
	</format>
	<format>
		<name>ZIP</name>
		<description></description>
		<mimetypes></mimetypes>
		<extensions></extensions>
		<superseeds></superseeds>
	</format>
	<format>
		<name>ZIP</name>
		<description></description>
		<mimetypes></mimetypes>
		<extensions></extensions>
		<superseeds></superseeds>
	</format>
	<format>
		<name>ZIP</name>
		<description></description>
		<mimetypes></mimetypes>
		<extensions></extensions>
		<superseeds></superseeds>
	</format>
	<format>
		<name>ZIP</name>
		<description></description>
		<mimetypes></mimetypes>
		<extensions></extensions>
		<superseeds></superseeds>
	</format>
	<format>
		<name>ZIP</name>
		<description></description>
		<mimetypes></mimetypes>
		<extensions></extensions>
		<superseeds></superseeds>
	</format>
	<format>
		<name>ZIP</name>
		<description></description>
		<mimetypes></mimetypes>
		<extensions></extensions>
		<superseeds></superseeds>
	</format>
	<format>
		<name>ZIP</name>
		<description></description>
		<mimetypes></mimetypes>
		<extensions></extensions>
		<superseeds></superseeds>
	</format>
	<format>
		<name>ZIP</name>
		<description></description>
		<mimetypes></mimetypes>
		<extensions></extensions>
		<superseeds></superseeds>
	</format>
	<format>
		<name>ZIP</name>
		<description></description>
		<mimetypes></mimetypes>
		<extensions></extensions>
		<superseeds></superseeds>
	</format>
	<format>
		<name>ZIP</name>
		<description></description>
		<mimetypes></mimetypes>
		<extensions></extensions>
		<superseeds></superseeds>
	</format>
	<format>
		<name>ZIP</name>
		<description></description>
		<mimetypes></mimetypes>
		<extensions></extensions>
		<superseeds></superseeds>
	</format>
	<format>
		<name>ZIP</name>
		<description></description>
		<mimetypes></mimetypes>
		<extensions></extensions>
		<superseeds></superseeds>
	</format>
	<format>
		<name>ZIP</name>
		<description></description>
		<mimetypes></mimetypes>
		<extensions></extensions>
		<superseeds></superseeds>
	</format>
	<format>
		<name>ZIP</name>
		<description></description>
		<mimetypes></mimetypes>
		<extensions></extensions>
		<superseeds></superseeds>
	</format>
	<format>
		<name>ZIP</name>
		<description></description>
		<mimetypes></mimetypes>
		<extensions></extensions>
		<superseeds></superseeds>
	</format>
	<format>
		<name>ZIP</name>
		<description></description>
		<mimetypes></mimetypes>
		<extensions></extensions>
		<superseeds></superseeds>
	</format>
	<format>
		<name>ZIP</name>
		<description></description>
		<mimetypes></mimetypes>
		<extensions></extensions>
		<superseeds></superseeds>
	</format>
	<format>
		<name>ZIP</name>
		<description></description>
		<mimetypes></mimetypes>
		<extensions></extensions>
		<superseeds></superseeds>
	</format>
</formats>